{"type":"config","name":"Figma .fig import fidelity","metricName":"total_diffs","metricUnit":"","bestDirection":"lower"}
{"run":1,"commit":"8a90594","metric":246,"metrics":{"visibility":1,"text":0,"fills":10,"radius":161,"size":74,"unmatched":99},"status":"keep","description":"Baseline: 246 diffs (1 vis, 0 text, 10 fills, 161 radius, 74 size, 99 unmatched)","timestamp":1773482910363,"segment":0}
{"run":2,"commit":"3746d1a","metric":99,"metrics":{"visibility":1,"text":0,"fills":10,"radius":14,"size":74,"unmatched":99},"status":"keep","description":"Fix comparison: read individual corner radii when independentCorners=true","timestamp":1773483304162,"segment":0}
{"run":3,"commit":"7fc3a64","metric":85,"metrics":{"visibility":1,"text":0,"fills":10,"radius":0,"size":74,"unmatched":99},"status":"keep","description":"Fix comparison: treat both-pill cornerRadius values as equal","timestamp":1773483389254,"segment":0}
{"run":4,"commit":"2858d94","metric":84,"metrics":{"visibility":1,"text":0,"fills":9,"radius":0,"size":74,"unmatched":99},"status":"keep","description":"Skip self-referencing symbolOverrides on nodes with explicit kiwi properties (fixes bold toolbar button fill)","timestamp":1773484182748,"segment":0}
{"run":5,"commit":"fd5b0b5","metric":106,"metrics":{"visibility":1,"text":0,"fills":11,"radius":0,"size":94,"unmatched":0},"status":"keep","description":"Name-based tree path matching: 0 unmatched (was 99), reveals 106 total real diffs","timestamp":1773488934943,"segment":0}
{"run":6,"commit":"97ba675","metric":70,"metrics":{"visibility":1,"text":0,"fills":11,"radius":0,"size":58,"unmatched":0},"status":"keep","description":"Apply SCALE constraint resizing to instance children + propagate through clone chains","timestamp":1773489529498,"segment":0}
{"run":7,"commit":"4f3df83","metric":62,"metrics":{"visibility":1,"text":0,"fills":11,"radius":0,"size":50,"unmatched":0},"status":"keep","description":"Skip SCALE constraint resizing for auto-layout instances (fixes Avatar distortion)","timestamp":1773490511259,"segment":0}
{"run":8,"commit":"919e4cf","metric":62,"metrics":{"visibility":1,"text":0,"fills":11,"radius":0,"size":50,"unmatched":0},"status":"discard","description":"Analysis only: remaining 11 fills are all library variable aliases, 50 sizes are layout-dependent","timestamp":1773491467403,"segment":0}
{"run":9,"commit":"4f3df83","metric":62,"metrics":{"visibility":1,"text":0,"fills":11,"radius":0,"size":50,"unmatched":0},"status":"discard","description":"Reverted kiwiPropertyNodes/extraSeeds experiments — too complex, caused regressions","timestamp":1773493300107,"segment":0}
